No,Data Ulasan,Sentimen Manual,SentiStrength,Multiclass Confusion Matrix,,,,,,
225,pesan tanggal kirim tanggal padahal tanggal bawa terbang kecewa kali dapat layan kurang senang padahal produk bagus jadi guna tetap avoskin,Negatif,netral,F NegNet,,,,,,
226,bagus sih produk cocok cuma sedikit kecewa packagingnya kurang aman enggak bublewrapnya padahal jalan jauh sidoarjo jakarta,Negatif,positif,F NegPos,,,,,,
227,kirim pakai sicepat sangat lambat gudang tanggal baru antar rumah tanggal sayang banget enggak sesuai nama,Negatif,netral,F NegNet,,,,,,
228,paket terima ada baik,Positif,positif,T Pos,,,,,,
229,baru pertama pakai moga cocok min tipe kulit minyak tipe kulit kombinasi,Netral,positif,F NetPos,,,,,,
230,fast respon,Positif,netral,F PosNet,,,,,,
231,nice,Positif,netral,F PosNet,,,,,,
232,worth the price pcs harga cashback,Netral,netral,T Net,,,,,,
233,thanks,Positif,netral,F PosNet,,,,,,
234,packing aman banget moga cocok,Positif,positif,T Pos,,,,,,
235,alhamdulillah aku cocok pakai azarine kulit wajah ku perlahan atas azarine thanks azarine,Positif,positif,T Pos,,,,,,
236,repurchased indak bikin kusam affordable,Netral,negatif,F NetNeg,,,,,,
237,isi dikit banget bingung ira enggak isi,Negatif,negatif,T Neg,,,,,,
238,ringan kulit warna pas,Netral,netral,T Net,,,,,,
239,cepat ringan sesuai nama tinted sunscreen buat tutup merah aku belum coba shade nina malah jadi kusam kuning akhir coba shade butter pas,Netral,positif,F NetPos,,,,,,
240,cepat tekstur creamy smugeproof loh warna kurang pigment,Negatif,positif,F NegPos,,,,,,
241,tekstur ringan mudah serap kulit spf nya jadi kalo pakai daily walaupun enggak full coverage tutup warna tidak rata muka bakal repurchase,Negatif,positif,F NegPos,,,,,,
242,kirim cepat packing oke thanks,Netral,positif,F NetPos,,,,,,
243,suka sama warna next order warna,Netral,positif,F NetPos,,,,,,
244,tipe kulit minyak alhamdulillah cocok thanks,Netral,positif,F NetPos,,,,,,
245,beli serum pas harga flash sale lumayan banget diskon packing oke kirim lumayan cepat produk belum coba jadi belum kasih nilai,Positif,positif,T Pos,,,,,,
246,jujur buat aku enggak cocok aku gapaham skincare cenderung asal beli cuma seperti works deh kalo memang cocok tipe kulit feel muka pakai lengket aku jadi enggak tidur miring terus bukan tipe skincare kalo kena angin adem muka cuma yaudah salah,Negatif,netral,F NegNet,,,,,,
247,hasil akhir bagus kayak kulit bersih sehat,Negatif,positif,F NegPos,,,,,,
